{
  "schema_version": 1,
  "thread_id": "MC-0015",
  "review_mode": "INDEPENDENT_THEN_COMPARATIVE",
  "lifecycle_state": "OPEN",
  "phase": "COMPARATIVE_CONSTRUCT_VALIDITY_REVIEW",
  "target": {
    "branch": "v1-source-vault-bootstrap-resume",
    "base_ref": "ae87c1facbf7c7d7508414e86a935bc439404c24",
    "description": "Both independent real-corpus judgment sets are frozen. Claude Message 003 is a bounded comparative review of RC-005, RC-006 and RC-012 plus the possible overlap among semantic first-classness, authority ownership/home and derived-view status. No target architecture or mechanized rule may be selected.",
    "write_paths": []
  },
  "task_owner": "chatgpt",
  "target_write_owner": null,
  "participants": [
    {
      "collaborator_id": "chatgpt",
      "interaction_environment": "ChatGPT",
      "interaction_session": "chatgpt-24",
      "roles": [
        "TASK_OWNER",
        "RESEARCHER",
        "CRITIC"
      ]
    },
    {
      "collaborator_id": "claude",
      "interaction_environment": "Claude",
      "interaction_session": "claude-03",
      "roles": [
        "REVIEWER",
        "RESEARCHER"
      ]
    },
    {
      "collaborator_id": "human",
      "interaction_environment": "Human",
      "interaction_session": "project-owner",
      "roles": [
        "HUMAN_DECIDER"
      ]
    }
  ],
  "allowed_secondary_write_surfaces": [
    {
      "collaborator_id": "claude",
      "paths": [
        "docs/model_collaboration/threads/MC-0015/messages/**"
      ]
    }
  ],
  "next_expected_actor": "claude",
  "independence": {
    "status": "COMPARATIVE_ONLY",
    "review_base_ref": "ae87c1facbf7c7d7508414e86a935bc439404c24",
    "known_exposures": [
      "Claude Message 001 remains the preserved independent reviewer-label result at commit 507db2cf5916df59a4aeaf053ac695f13636c14f.",
      "Comparative Phase now intentionally exposes ChatGPT judgment labels/rationales through Message 002 and Research 142.",
      "The comparative turn is restricted to RC-005, RC-006, RC-012, taxonomy construct validity and architecture-neutral evidence implications."
    ],
    "notes": "Independence is complete and preserved in Message 001. Message 003 is intentionally comparative and must not be described as independent."
  },
  "last_transition": {
    "transition_id": "mc0015-independent-complete-comparative-construct-review-open",
    "from_state": "OPEN",
    "to_state": "OPEN",
    "actor": "chatgpt",
    "reason": "Claude independent judgments are frozen and compared with ChatGPT. Three material disagreements reveal possible taxonomy overlap and one packet-grounding issue, warranting one bounded comparative turn before mechanized admission work.",
    "repository_head": "507db2cf5916df59a4aeaf053ac695f13636c14f"
  }
}
