{
  "schema_version": 1,
  "thread_id": "MC-0014",
  "review_mode": "ADVERSARIAL_REVIEW",
  "lifecycle_state": "RESOLVED",
  "phase": "RESOLVED_ADVERSARIAL_INTERPRETATION_COMPLETE",
  "target": {
    "branch": "v1-source-vault-bootstrap-resume",
    "base_ref": "85ade407b2f1957f5a3980aca92c09500db430b8",
    "description": "MC-0014 adversarial interpretation complete. V0.2 admission selectivity was downgraded as circular/self-confirming, strong H1 and H2 were recognized as near-identical relation reification with different ownership/addressing, bounded-spine terminology was retired, and a real-corpus independent-judgment discriminator is next.",
    "write_paths": []
  },
  "task_owner": "chatgpt",
  "target_write_owner": null,
  "participants": [
    {
      "collaborator_id": "chatgpt",
      "interaction_environment": "ChatGPT",
      "interaction_session": "chatgpt-24",
      "roles": [
        "TASK_OWNER",
        "RESEARCHER",
        "CRITIC"
      ]
    },
    {
      "collaborator_id": "claude",
      "interaction_environment": "Claude",
      "interaction_session": "claude-03",
      "roles": [
        "REVIEWER",
        "RESEARCHER",
        "CRITIC"
      ]
    },
    {
      "collaborator_id": "human",
      "interaction_environment": "Human",
      "interaction_session": "project-owner",
      "roles": [
        "HUMAN_DECIDER"
      ]
    }
  ],
  "allowed_secondary_write_surfaces": [
    {
      "collaborator_id": "claude",
      "paths": [
        "docs/model_collaboration/threads/MC-0014/messages/**"
      ]
    }
  ],
  "next_expected_actor": "human",
  "independence": {
    "status": "NOT_APPLICABLE",
    "review_base_ref": "85ade407b2f1957f5a3980aca92c09500db430b8",
    "known_exposures": [
      "Claude participated in MC-0011 through MC-0013 and already knows the Research 124 architecture problem and earlier candidate-family reasoning.",
      "This review intentionally exposes ChatGPT Research 136 and Research 138 interpretations together with the raw V0.1/V0.2 fixtures, implementations and results.",
      "The epistemic goal is adversarial interpretation of shared evidence, not candidate-design independence."
    ],
    "notes": "No blindness claim is made. Exact-target binding exists for reproducibility and drift control, not independence."
  },
  "last_transition": {
    "transition_id": "mc0014-adversarial-review-resolved",
    "from_state": "OPEN",
    "to_state": "RESOLVED",
    "actor": "chatgpt",
    "reason": "Claude Message 001 exposed material interpretation defects that ChatGPT accepts. No unresolved disagreement remains; the next uncertainty requires real-corpus behavioral evidence rather than another architecture dialogue round.",
    "repository_head": "e7834d626f5092be06fc9485d90e2d01a76033bb"
  }
}
