{
  "schema_version": 1,
  "thread_id": "MC-0028",
  "review_mode": "INDEPENDENT_THEN_COMPARATIVE",
  "lifecycle_state": "WAITING",
  "phase": "DECISION_PROBES_RUNNING",
  "target": {
    "branch": "v1-source-vault-bootstrap-resume",
    "base_ref": "cac7a699eb012c5a02e1c5fab349ebc9e5726145",
    "description": "Independent target assurance / verification / testing / CI-CD / delivery architecture design from frozen Research 273 requirements.",
    "write_paths": []
  },
  "task_owner": "chatgpt",
  "target_write_owner": null,
  "participants": [
    {
      "collaborator_id": "chatgpt",
      "interaction_environment": "ChatGPT",
      "interaction_session": "chatgpt-30",
      "roles": [
        "TASK_OWNER",
        "RESEARCHER",
        "CRITIC"
      ]
    },
    {
      "collaborator_id": "claude",
      "interaction_environment": "Claude",
      "interaction_session": "claude-03",
      "roles": [
        "INDEPENDENT_REVIEWER",
        "RESEARCHER",
        "CRITIC",
        "COUNTER_DESIGNER"
      ]
    },
    {
      "collaborator_id": "human",
      "interaction_environment": "Human",
      "interaction_session": "project-owner",
      "roles": [
        "HUMAN_DECIDER"
      ]
    }
  ],
  "allowed_secondary_write_surfaces": [
    {
      "collaborator_id": "claude",
      "paths": [
        "docs/model_collaboration/threads/MC-0028/messages/**"
      ]
    }
  ],
  "next_expected_actor": "chatgpt",
  "independence": {
    "status": "COMPARATIVE_ONLY",
    "review_base_ref": "cac7a699eb012c5a02e1c5fab349ebc9e5726145",
    "known_exposures": [
      "Claude Message 001 was produced from frozen base cac7a699eb012c5a02e1c5fab349ebc9e5726145 before reading Research 274.",
      "The new Claude conversation title is 04 - Assurance and Delivery Architecture Design; the durable participant slot remains claude-03 under the thread schema.",
      "Comparative exposure is now intentionally authorized: Claude may read Research 274 FACET, Research 275 WARRANT-F V0.1, and its own Message 001 WARRANT.",
      "Claude Message 003 completed comparative critique at b6ac1d492216265e1351e420179d149928bffa8e. Research 276 / Message 004 reconcile it into WARRANT-F V0.2."
    ],
    "notes": "Research 307 / Checkpoint 642 record P-S PASS: all eight frozen stochastic desk-study criteria pass. The current two-item Prototype V0 corpus remains OBSERVE_ONLY for decision-grade BLOCK, while a future paired item-clustered campaign with item-level public/private separation is designable; the conservative MDE 0.10 sensitivity is feasible at J=29 independent items, R=2 and 116 total candidate+baseline executions. All eight decision-relevant probes are now valid or explicitly scoped, with no unresolved AMEND and no active HARNESS_INVALID result. Total probe reconciliation and owner-decision readiness are next."
  },
  "last_transition": {
    "transition_id": "mc0028-p-s-pass",
    "from_state": "WAITING",
    "to_state": "WAITING",
    "actor": "chatgpt",
    "reason": "Research 307 / Checkpoint 642 reconcile P-S as PASS and complete all eight decision-relevant probes. Total owner-decision-readiness synthesis is next.",
    "repository_head": "84a1c291c3b61e496cffc1a5e179efb22197697f"
  }
}
