{
  "schema_version": 1,
  "thread_id": "MC-0029",
  "review_mode": "INDEPENDENT_THEN_COMPARATIVE",
  "lifecycle_state": "WAITING",
  "phase": "DRP03_R2_KEY_B_P8_CLASSIFICATION_OUTPUT_CONTRACT_HARNESS_REPAIR",
  "target": {
    "branch": "v1-source-vault-bootstrap-resume",
    "base_ref": "0a68787aee5f2c6332d6ee1fb6adbf0efe92a41d",
    "description": "Independent Specification 028 reconciliation and AO-10 realization design from the accepted pre-Research-312 architecture base, under the owner clarification that semantic architecture has no target preservation right and the result must cohere as one professional Project system.",
    "write_paths": []
  },
  "task_owner": "chatgpt",
  "target_write_owner": null,
  "participants": [
    {
      "collaborator_id": "chatgpt",
      "interaction_environment": "ChatGPT",
      "interaction_session": "chatgpt-34",
      "roles": [
        "TASK_OWNER",
        "RESEARCHER",
        "CRITIC"
      ]
    },
    {
      "collaborator_id": "claude",
      "interaction_environment": "Claude",
      "interaction_session": "claude-04",
      "roles": [
        "INDEPENDENT_REVIEWER",
        "RESEARCHER",
        "CRITIC",
        "COUNTER_DESIGNER"
      ]
    },
    {
      "collaborator_id": "human",
      "interaction_environment": "Human",
      "interaction_session": "project-owner",
      "roles": [
        "HUMAN_DECIDER"
      ]
    },
    {
      "collaborator_id": "claude-code-a",
      "interaction_environment": "Claude Code local",
      "interaction_session": "TBD_PER_PHASE",
      "roles": [
        "RESEARCHER",
        "VERIFIER"
      ]
    }
  ],
  "allowed_secondary_write_surfaces": [
    {
      "collaborator_id": "claude",
      "paths": [
        "docs/model_collaboration/threads/MC-0029/messages/**"
      ]
    }
  ],
  "next_expected_actor": "chatgpt",
  "independence": {
    "status": "COMPARATIVE_ONLY",
    "review_base_ref": "0a68787aee5f2c6332d6ee1fb6adbf0efe92a41d",
    "known_exposures": [
      "Claude may read MC-0029 routing/brief files from current state for task instructions.",
      "Claude must not inspect Research 312 or later ChatGPT AO-10 candidate material before Message 001 is committed.",
      "Owner clarification dated 2026-09-25 is visible through the MC-0029 brief: semantic architecture and Research 217 are evidence rather than target constraints, and the design must be evaluated as one integrated professional Project system. This instruction does not expose Research 312.",
      "The actual current Claude conversation is interaction claude-04, titled 04 - Assurance and Delivery Architecture Design. MC-0028 originally carried claude-03 by clerical provenance error; that error is corrected explicitly and is not a participant-slot convention.",
      "Claude Message 001 was committed at 74023a779998200a6317df07dc7cd4979ff84e47 before comparative exposure.",
      "Comparative exposure to ChatGPT Research 312, Research 314 and Message 002 is now authorized for MC-0029 Message 003.",
      "Claude Message 003 completed comparative critique at 79b915894e0b055aadea05fe7d5767aa223d423e.",
      "Research 315 / Message 004 reconcile Message 003 into V0.3 and route MC-0029 to DRP-01 through DRP-09 preregistration.",
      "DRP-01 ChatGPT Annotation A was frozen before Claude Annotation B existed.",
      "For DRP-01 Annotation B, Claude may read Research 316, Research 321, the reviewer packet/schema/definitions/corpus, and frozen source carriers at 870689734673e6e8c2212035afcdf27daf733c15.",
      "Before committing Annotation B, Claude must not inspect experiments/ao10_drp01_shared_semantic_substrate_v01/annotation_chatgpt_a.json, Research 322, or later derivative summaries of Annotation A.",
      "DRP-03 Claude reviewer A must not inspect experiments/ao10_drp03_obligation_units_v01/evaluator_key.json before committing its annotation.",
      "DRP-03 Claude reviewer A must not inspect Research 324 or any future ChatGPT DRP-03 annotation/summary before committing its annotation.",
      "DRP-03 reviewer-facing materials are REVIEWER_PACKET.md, review_scope.json, implementation_snapshot.json, definitions.json, annotation_schema.json, and the frozen source/support carriers at 870689734673e6e8c2212035afcdf27daf733c15.",
      "P1 owner-pasted Claude Code console output exposed a limited Key A STATE semantic preview to the human owner and chatgpt-31 after P1 output freeze. This did not enter Git or reviewer storage. chatgpt-31 is therefore not eligible as a fresh decision reviewer, and future Key Author B must not receive access to this conversation."
    ],
    "notes": "Research 426 records recurrence of P8_SEMANTIC_OUTPUT_INVALID after the fresh replacement advanced the accepted Key B BIRTH classification prefix to 3/15. Mechanical inspection of the active P8 implementation, without opening failed semantic output, shows the generation JSON schema is less strict than the post-output validator: it does not bind exact current-batch IDs/count and does not encode the normative/normative_kind conditional. The failed-attempt classification output-contract layer is HARNESS_INVALID. Accepted STATE and the three accepted BIRTH batches remain frozen. Prospective repair is limited to making the structured-output schema project the existing validator constraints before one fresh resume."
  },
  "last_transition": {
    "transition_id": "mc0029-key-b-classification-output-contract-harness-repair",
    "from_state": "WAITING",
    "to_state": "WAITING",
    "actor": "chatgpt",
    "reason": "Research 426 identifies a non-semantic schema/validator contract mismatch after repeated P8 validation HOLD and freezes the narrow prospective harness repair.",
    "repository_head": "db2d454e0bdafe5bb66b1f341eb7a90c7b1b721e"
  }
}
