{
  "schema_version": 1,
  "thread_id": "MC-0003",
  "review_mode": "REVIEWED",
  "lifecycle_state": "ACTIVE",
  "phase": "DESIGN_ACTIVE",
  "target": {
    "branch": "v1-multimodel-development-collaboration",
    "base_ref": "40e1d317788f976ea2015cdd4a0aeef0cc0a8472",
    "description": "Design and later review deferred asynchronous review/catch-up semantics without modifying frozen Specification 024.",
    "write_paths": [
      "docs/research/036_deferred_asynchronous_review_and_catchup_architecture.md",
      "docs/model_collaboration/DEFERRED_REVIEW_AND_CATCHUP.md",
      "docs/model_collaboration/REVIEW_INBOX.md",
      "docs/model_collaboration/threads/MC-0003/BRIEF.md",
      "docs/model_collaboration/threads/MC-0003/THREAD.md",
      "docs/model_collaboration/threads/MC-0003/STATE.json"
    ]
  },
  "task_owner": "chatgpt",
  "target_write_owner": "chatgpt",
  "participants": [
    {
      "collaborator_id": "chatgpt",
      "interaction_environment": "ChatGPT",
      "interaction_session": "chatgpt-06",
      "roles": ["TASK_OWNER", "RESEARCHER"]
    },
    {
      "collaborator_id": "claude",
      "interaction_environment": "Claude",
      "interaction_session": "claude-01",
      "roles": ["REVIEWER"]
    },
    {
      "collaborator_id": "human",
      "interaction_environment": "Human",
      "interaction_session": "project-owner",
      "roles": ["HUMAN_DECIDER"]
    }
  ],
  "allowed_secondary_write_surfaces": [
    {
      "collaborator_id": "claude",
      "paths": ["docs/model_collaboration/threads/MC-0003/messages/**"]
    }
  ],
  "next_expected_actor": "chatgpt",
  "independence": {
    "status": "NOT_APPLICABLE",
    "review_base_ref": null,
    "known_exposures": [],
    "notes": "MC-0003 uses later direct review of a ChatGPT candidate extension; it is not intended as a blind independent counter-design."
  },
  "last_transition": {
    "transition_id": "mc0003-design-active",
    "from_state": "OPEN",
    "to_state": "ACTIVE",
    "actor": "chatgpt",
    "reason": "Open deferred-review/catch-up architecture design from the user-identified availability constraint.",
    "repository_head": "40e1d317788f976ea2015cdd4a0aeef0cc0a8472"
  }
}
