{
  "schema_version": 1,
  "thread_id": "MC-0027",
  "review_mode": "ADVERSARIAL_REVIEW",
  "lifecycle_state": "WAITING",
  "phase": "CORRECTED_RERUN_IMPLEMENTATION",
  "target": {
    "branch": "v1-source-vault-bootstrap-resume",
    "base_ref": "87603fff31609c45baac5b41ef29dc36b6625015",
    "description": "Adversarial audit of P-R8B-01 protocol fidelity, frozen harness, result validity and WMR-H V0.2 architecture-decision readiness.",
    "write_paths": []
  },
  "task_owner": "chatgpt",
  "target_write_owner": null,
  "participants": [
    {
      "collaborator_id": "chatgpt",
      "interaction_environment": "ChatGPT",
      "interaction_session": "chatgpt-29",
      "roles": ["TASK_OWNER", "RESEARCHER", "CRITIC"]
    },
    {
      "collaborator_id": "claude",
      "interaction_environment": "Claude",
      "interaction_session": "claude-03",
      "roles": ["REVIEWER", "RESEARCHER", "CRITIC"]
    },
    {
      "collaborator_id": "human",
      "interaction_environment": "Human",
      "interaction_session": "project-owner",
      "roles": ["HUMAN_DECIDER"]
    }
  ],
  "allowed_secondary_write_surfaces": [
    {
      "collaborator_id": "claude",
      "paths": ["docs/model_collaboration/threads/MC-0027/messages/**"]
    }
  ],
  "next_expected_actor": "chatgpt",
  "independence": {
    "status": "COMPARATIVE_ONLY",
    "review_base_ref": "87603fff31609c45baac5b41ef29dc36b6625015",
    "known_exposures": [
      "Claude participated in MC-0026 representation design and comparative critique.",
      "Claude did not author the P-R8B-01 harness or ChatGPT's Research 265 result interpretation.",
      "The audit is adversarial result interpretation, not an independent architecture-design claim."
    ],
    "notes": "Claude independently reproduced the frozen run, mutation-tested the harness, and returned AMEND. ChatGPT accepts the audit in Research 266. The original 18/18 run remains authentic but confirmatorily insufficient; P-R8B-01-R2 must correct invalid gates against unchanged thresholds before owner representation decision."
  },
  "last_transition": {
    "transition_id": "mc0027-audit-amend-accepted-corrected-rerun",
    "from_state": "WAITING",
    "to_state": "WAITING",
    "actor": "chatgpt",
    "reason": "Claude Message 001 returned AMEND after independent reproduction and mutation testing. Research 266 accepts the audit, amends the candidate narrowly to WMR-H V0.3, and freezes P-R8B-01-R2 corrected-rerun requirements.",
    "repository_head": "902fcfd15450a7ba3fb9f3e3542ef33790cf9af9"
  }
}
