{
  "schema_version": 1,
  "thread_id": "MC-0025",
  "review_mode": "ADVERSARIAL_REVIEW",
  "lifecycle_state": "RESOLVED",
  "phase": "R8A_ACCEPTED_AS_AMENDED",
  "target": {
    "branch": "v1-source-vault-bootstrap-resume",
    "base_ref": "39435d148b4170e13d150e178022d66408de0df1",
    "description": "Adversarial review of Research 257 R8-A exact target repository/workspace realization before owner acceptance, representation selection or physical migration.",
    "write_paths": []
  },
  "task_owner": "chatgpt",
  "target_write_owner": null,
  "participants": [
    {
      "collaborator_id": "chatgpt",
      "interaction_environment": "ChatGPT",
      "interaction_session": "chatgpt-29",
      "roles": ["TASK_OWNER", "RESEARCHER", "CRITIC"]
    },
    {
      "collaborator_id": "claude",
      "interaction_environment": "Claude",
      "interaction_session": "claude-03",
      "roles": ["REVIEWER", "RESEARCHER", "CRITIC", "COUNTER_DESIGNER"]
    },
    {
      "collaborator_id": "human",
      "interaction_environment": "Human",
      "interaction_session": "project-owner",
      "roles": ["HUMAN_DECIDER"]
    }
  ],
  "allowed_secondary_write_surfaces": [
    {
      "collaborator_id": "claude",
      "paths": ["docs/model_collaboration/threads/MC-0025/messages/**"]
    }
  ],
  "next_expected_actor": null,
  "independence": {
    "status": "NOT_APPLICABLE",
    "review_base_ref": "39435d148b4170e13d150e178022d66408de0df1",
    "known_exposures": [
      "Claude has persistent claude-03 context for the Project-knowledge and whole-repository architecture program.",
      "The review intentionally exposes the complete Research 257 proposal and its accepted R5-R7/AO inputs.",
      "Claude previously participated in MC-0021 through MC-0024 and therefore has prior exposure to several upstream architecture decisions."
    ],
    "notes": "This adversarial post-proposal review is resolved. Claude Message 001 returned AMEND at commit 14bb28f0094a7a30d4f29798e916bb4ee77fdda7. ChatGPT reconciled all nine amendments plus eleven clarifications in Message 002 / Research 258. The owner explicitly chose AMEND and additionally clarified that future representation, metadata and file-internal structure are redesignable from scratch; Research 259 records that accepted clarification."
  },
  "last_transition": {
    "transition_id": "mc0025-owner-amendment-accepted-thread-resolved",
    "from_state": "WAITING",
    "to_state": "RESOLVED",
    "actor": "human",
    "reason": "The project owner explicitly chose AMEND, accepting Research 257 as amended by Research 258 and clarifying that future representation, metadata and file-internal structures are redesignable from scratch. Research 259 records the accepted target and next-stage freedom.",
    "repository_head": "7e9dafd675611632769a482cffca69661567a00e"
  }
}
